<?xml version="1.0" encoding="ISO-8859-1" standalone="yes"?>

<!DOCTYPE rememberedProjects [
<!ELEMENT rememberedProjects (info,project*)>
<!ELEMENT info (version)>
<!ELEMENT version (#PCDATA)>
<!ELEMENT project (name,rootFolder,xmlRelativePath)>
<!ELEMENT name (#PCDATA)>
<!ELEMENT rootFolder (#PCDATA)>
<!ELEMENT xmlRelativePath (#PCDATA)>
]>
<rememberedProjects>
	<info>
		<version>1.0</version>
	</info>
	<project>
		<name>VBAToolKit</name>
		<rootFolder>C:\Documents and Settings\Demonn\Bureau\VBAToolKit</rootFolder>
		<xmlRelativePath>Project\VBAToolKit.xml</xmlRelativePath>
	</project>
	<project>
		<name>MacroDEV</name>
		<rootFolder>C:\Documents and Settings\Demonn\Mes documents\MacroDEV</rootFolder>
		<xmlRelativePath>.\Project\MacroDEV.xml</xmlRelativePath>
	</project>
</rememberedProjects>